{
  "protocolVersion": 1,
  "messageId": "msg.coordination-01",
  "fromParticipantId": "orchestrator.build-01",
  "toParticipantId": "agent.reviewer-01",
  "scopeId": "workspace.agents-orchestrator",
  "messageType": "review.requested",
  "classification": "internal",
  "body": "Review task A/0/00 and reply with the verdict.",
  "createdAt": "2026-07-25T10:01:00.000Z",
  "traceId": "tr-coordination-example",
  "correlationId": "task.A-0-00"
}
